{
  "$schema": "http://json-schema.org/draft-07/schema#",
  "$id": "https://macao.dev/schemas/v2.3/review_context.schema.json",
  "title": "MACAO REVIEW_REQUEST review_context（唯一权威结构，见 PRD §5.2）",
  "type": "object",
  "required": ["dev_checkpoint", "repository", "task_info", "code_changes", "quality_snapshot"],
  "properties": {
    "dev_checkpoint": {
      "type": "object",
      "required": ["path"],
      "properties": {
        "path": { "type": "string", "minLength": 1 },
        "content_base64": { "type": "string" }
      }
    },
    "repository": {
      "type": "object",
      "required": ["workspace_path", "remote_name"],
      "properties": {
        "workspace_path": { "type": "string", "minLength": 1 },
        "remote_name": { "type": "string", "minLength": 1 },
        "fetch_policy": { "type": "string" }
      }
    },
    "task_info": {
      "type": "object",
      "required": ["description"],
      "properties": {
        "description": { "type": "string", "minLength": 1 },
        "business_impact": { "type": "string" },
        "timeline_info": { "type": "string" },
        "review_focus": { "type": "array", "items": { "type": "string" } }
      }
    },
    "code_changes": {
      "type": "object",
      "required": ["refs"],
      "properties": {
        "refs": {
          "type": "object",
          "required": ["base_commit", "head_commit"],
          "properties": {
            "base_commit": { "type": "string", "minLength": 1 },
            "head_commit": { "type": "string", "minLength": 1 }
          }
        },
        "diff_command": { "type": "string" },
        "summary": {
          "type": "object",
          "properties": {
            "files_changed": { "type": "integer", "minimum": 0 },
            "insertions": { "type": "integer", "minimum": 0 },
            "deletions": { "type": "integer", "minimum": 0 }
          }
        },
        "files_list": {
          "type": "array",
          "items": {
            "type": "object",
            "required": ["path"],
            "properties": {
              "path": { "type": "string" },
              "status": { "type": "string" },
              "added_lines": { "type": "integer", "minimum": 0 },
              "deleted_lines": { "type": "integer", "minimum": 0 }
            }
          }
        }
      },
      "additionalProperties": false
    },
    "quality_snapshot": {
      "type": "object",
      "required": ["tests"],
      "properties": {
        "tests": {
          "type": "object",
          "required": ["passed", "failed", "coverage"],
          "properties": {
            "passed": { "type": "integer", "minimum": 0 },
            "failed": { "type": "integer", "minimum": 0 },
            "coverage": { "type": "number", "minimum": 0, "maximum": 1 }
          }
        },
        "static_analysis": { "type": "object" },
        "performance": { "type": "object" }
      }
    },
    "executor_self_assessment": {
      "type": "object",
      "properties": {
        "what_was_done": { "type": "string" },
        "review_focus": { "type": "array", "items": { "type": "string" } },
        "known_limitations": { "type": "array", "items": { "type": "string" } }
      }
    },
    "history": {
      "type": "object",
      "properties": {
        "previous_reviews": { "type": "integer", "minimum": 0 },
        "previous_feedback": { "type": "array" }
      }
    },
    "references": { "type": "object" }
  }
}
