{
  "dev_checkpoint": { "path": ".macao/.dev.yml", "content_base64": "..." },
  "repository": { "workspace_path": "~/work/macao-demo/.macao/worktrees/codex/r1", "remote_name": "origin", "fetch_policy": "fetch_before_diff" },
  "task_info": { "description": "Refactor database connection pooling", "review_focus": ["Thread safety"] },
  "code_changes": {
    "refs": { "base_commit": "b2c3d4e", "head_commit": "a1b2c3d" },
    "diff_command": "git diff b2c3d4e..a1b2c3d",
    "summary": { "files_changed": 5, "insertions": 120, "deletions": 45 },
    "files_list": [
      { "path": "src/db/connection.py", "status": "modified", "added_lines": 80, "deleted_lines": 30 }
    ]
  },
  "quality_snapshot": {
    "tests": { "passed": 24, "failed": 0, "coverage": 0.87 },
    "static_analysis": { "lint_errors": 0 }
  },
  "history": { "previous_reviews": 0, "previous_feedback": [] }
}
