{
  "dev_checkpoint": { "path": ".macao/.dev.yml", "content_base64": "..." },
  "repository": { "workspace_path": "~/work/macao-demo", "remote_name": "origin", "fetch_policy": "fetch_before_diff" },
  "task_info": {
    "description": "Refactor database connection pooling",
    "business_impact": "Improves pool efficiency by 30%",
    "review_focus": ["Thread safety", "Timeout correctness"]
  },
  "code_changes": {
    "refs": { "base_commit": "b2c3d4e", "head_commit": "a1b2c3d" },
    "diff_command": "git diff b2c3d4e..a1b2c3d",
    "summary": { "files_changed": 5, "insertions": 120, "deletions": 45 },
    "files_list": [
      { "path": "src/db/connection.py", "status": "modified", "added_lines": 80, "deleted_lines": 30 },
      { "path": "tests/test_db.py", "status": "modified", "added_lines": 35, "deleted_lines": 12 }
    ]
  },
  "quality_snapshot": {
    "tests": { "passed": 24, "failed": 0, "coverage": 0.87 },
    "static_analysis": { "lint_errors": 0, "security_issues": 0, "type_check_errors": 0 },
    "performance": { "avg_query_time_ms": 45, "p99_query_time_ms": 120 }
  },
  "executor_self_assessment": {
    "what_was_done": "Refactored pooling logic; added timeout params; tests; docs",
    "review_focus": ["Thread safety", "Backward compatibility"],
    "known_limitations": ["Connection retry logic not implemented yet"]
  },
  "history": { "previous_reviews": 0, "previous_feedback": [] },
  "references": { "architecture_doc": "docs/db_design.md", "related_tickets": ["TASK-123"] }
}
